Published Date,Link,Title,Summary,First Author
2024-01-02T17:56:30Z,http://arxiv.org/abs/2401.01313v3,"A Comprehensive Survey of Hallucination Mitigation Techniques in Large
  Language Models","As Large Language Models (LLMs) continue to advance in their ability to write
human-like text, a key challenge remains around their tendency to hallucinate
generating content that appears factual but is ungrounded. This issue of
hallucination is arguably the biggest hindrance to safely deploying these
powerful LLMs into real-world production systems that impact people's lives.
The journey toward widespread adoption of LLMs in practical settings heavily
relies on addressing and mitigating hallucinations. Unlike traditional AI
systems focused on limited tasks, LLMs have been exposed to vast amounts of
online text data during training. While this allows them to display impressive
language fluency, it also means they are capable of extrapolating information
from the biases in training data, misinterpreting ambiguous prompts, or
modifying the information to align superficially with the input. This becomes
hugely alarming when we rely on language generation capabilities for sensitive
applications, such as summarizing medical records, financial analysis reports,
etc. This paper presents a comprehensive survey of over 32 techniques developed
to mitigate hallucination in LLMs. Notable among these are Retrieval Augmented
Generation (Lewis et al, 2021), Knowledge Retrieval (Varshney et al,2023),
CoNLI (Lei et al, 2023), and CoVe (Dhuliawala et al, 2023). Furthermore, we
introduce a detailed taxonomy categorizing these methods based on various
parameters, such as dataset utilization, common tasks, feedback mechanisms, and
retriever types. This classification helps distinguish the diverse approaches
specifically designed to tackle hallucination issues in LLMs. Additionally, we
analyze the challenges and limitations inherent in these techniques, providing
a solid foundation for future research in addressing hallucinations and related
phenomena within the realm of LLMs.",S. M Towhidul Islam Tonmoy
2024-01-05T15:09:57Z,http://arxiv.org/abs/2401.02851v2,"Natural Language Programming in Medicine: Administering Evidence Based
  Clinical Workflows with Autonomous Agents Powered by Generative Large
  Language Models","Generative Large Language Models (LLMs) hold significant promise in
healthcare, demonstrating capabilities such as passing medical licensing exams
and providing clinical knowledge. However, their current use as information
retrieval tools is limited by challenges like data staleness, resource demands,
and occasional generation of incorrect information. This study assessed the
potential of LLMs to function as autonomous agents in a simulated tertiary care
medical center, using real-world clinical cases across multiple specialties.
Both proprietary and open-source LLMs were evaluated, with Retrieval Augmented
Generation (RAG) enhancing contextual relevance. Proprietary models,
particularly GPT-4, generally outperformed open-source models, showing improved
guideline adherence and more accurate responses with RAG. The manual evaluation
by expert clinicians was crucial in validating models' outputs, underscoring
the importance of human oversight in LLM operation. Further, the study
emphasizes Natural Language Programming (NLP) as the appropriate paradigm for
modifying model behavior, allowing for precise adjustments through tailored
prompts and real-world interactions. This approach highlights the potential of
LLMs to significantly enhance and supplement clinical decision-making, while
also emphasizing the value of continuous expert involvement and the flexibility
of NLP to ensure their reliability and effectiveness in healthcare settings.",Akhil Vaid
2024-01-10T02:57:20Z,http://arxiv.org/abs/2401.06800v1,Reinforcement Learning for Optimizing RAG for Domain Chatbots,"With the advent of Large Language Models (LLM), conversational assistants
have become prevalent for domain use cases. LLMs acquire the ability to
contextual question answering through training, and Retrieval Augmented
Generation (RAG) further enables the bot to answer domain-specific questions.
This paper describes a RAG-based approach for building a chatbot that answers
user's queries using Frequently Asked Questions (FAQ) data. We train an
in-house retrieval embedding model using infoNCE loss, and experimental results
demonstrate that the in-house model works significantly better than the
well-known general-purpose public embedding model, both in terms of retrieval
accuracy and Out-of-Domain (OOD) query detection. As an LLM, we use an open
API-based paid ChatGPT model. We noticed that a previously retrieved-context
could be used to generate an answer for specific patterns/sequences of queries
(e.g., follow-up queries). Hence, there is a scope to optimize the number of
LLM tokens and cost. Assuming a fixed retrieval model and an LLM, we optimize
the number of LLM tokens using Reinforcement Learning (RL). Specifically, we
propose a policy-based model external to the RAG, which interacts with the RAG
pipeline through policy actions and updates the policy to optimize the cost.
The policy model can perform two actions: to fetch FAQ context or skip
retrieval. We use the open API-based GPT-4 as the reward model. We then train a
policy model using policy gradient on multiple training chat sessions. As a
policy model, we experimented with a public gpt-2 model and an in-house BERT
model. With the proposed RL-based optimization combined with similarity
threshold, we are able to achieve significant cost savings while getting a
slightly improved accuracy. Though we demonstrate results for the FAQ chatbot,
the proposed RL approach is generic and can be experimented with any existing
RAG pipeline.",Mandar Kulkarni
2024-01-16T14:44:47Z,http://arxiv.org/abs/2401.08406v3,"RAG vs Fine-tuning: Pipelines, Tradeoffs, and a Case Study on
  Agriculture","There are two common ways in which developers are incorporating proprietary
and domain-specific data when building applications of Large Language Models
(LLMs): Retrieval-Augmented Generation (RAG) and Fine-Tuning. RAG augments the
prompt with the external data, while fine-Tuning incorporates the additional
knowledge into the model itself. However, the pros and cons of both approaches
are not well understood. In this paper, we propose a pipeline for fine-tuning
and RAG, and present the tradeoffs of both for multiple popular LLMs, including
Llama2-13B, GPT-3.5, and GPT-4. Our pipeline consists of multiple stages,
including extracting information from PDFs, generating questions and answers,
using them for fine-tuning, and leveraging GPT-4 for evaluating the results. We
propose metrics to assess the performance of different stages of the RAG and
fine-Tuning pipeline. We conduct an in-depth study on an agricultural dataset.
Agriculture as an industry has not seen much penetration of AI, and we study a
potentially disruptive application - what if we could provide location-specific
insights to a farmer? Our results show the effectiveness of our dataset
generation pipeline in capturing geographic-specific knowledge, and the
quantitative and qualitative benefits of RAG and fine-tuning. We see an
accuracy increase of over 6 p.p. when fine-tuning the model and this is
cumulative with RAG, which increases accuracy by 5 p.p. further. In one
particular experiment, we also demonstrate that the fine-tuned model leverages
information from across geographies to answer specific questions, increasing
answer similarity from 47% to 72%. Overall, the results point to how systems
built using LLMs can be adapted to respond and incorporate knowledge across a
dimension that is critical for a specific industry, paving the way for further
applications of LLMs in other industrial domains.",Angels Balaguer
2024-01-27T02:29:42Z,http://arxiv.org/abs/2401.15269v3,"Improving Medical Reasoning through Retrieval and Self-Reflection with
  Retrieval-Augmented Large Language Models","Recent proprietary large language models (LLMs), such as GPT-4, have achieved
a milestone in tackling diverse challenges in the biomedical domain, ranging
from multiple-choice questions to long-form generations. To address challenges
that still cannot be handled with the encoded knowledge of LLMs, various
retrieval-augmented generation (RAG) methods have been developed by searching
documents from the knowledge corpus and appending them unconditionally or
selectively to the input of LLMs for generation. However, when applying
existing methods to different domain-specific problems, poor generalization
becomes apparent, leading to fetching incorrect documents or making inaccurate
judgments. In this paper, we introduce Self-BioRAG, a framework reliable for
biomedical text that specializes in generating explanations, retrieving
domain-specific documents, and self-reflecting generated responses. We utilize
84k filtered biomedical instruction sets to train Self-BioRAG that can assess
its generated explanations with customized reflective tokens. Our work proves
that domain-specific components, such as a retriever, domain-related document
corpus, and instruction sets are necessary for adhering to domain-related
instructions. Using three major medical question-answering benchmark datasets,
experimental results of Self-BioRAG demonstrate significant performance gains
by achieving a 7.2% absolute improvement on average over the state-of-the-art
open-foundation model with a parameter size of 7B or less. Overall, we analyze
that Self-BioRAG finds the clues in the question, retrieves relevant documents
if needed, and understands how to answer with information from retrieved
documents and encoded knowledge as a medical expert does. We release our data
and code for training our framework components and model weights (7B and 13B)
to enhance capabilities in biomedical and clinical domains.",Minbyul Jeong
2024-01-27T10:50:11Z,http://arxiv.org/abs/2401.15378v4,"A RAG-based Question Answering System Proposal for Understanding Islam:
  MufassirQAS LLM","Challenges exist in learning and understanding religions, such as the
complexity and depth of religious doctrines and teachings. Chatbots as
question-answering systems can help in solving these challenges. LLM chatbots
use NLP techniques to establish connections between topics and accurately
respond to complex questions. These capabilities make it perfect for
enlightenment on religion as a question-answering chatbot. However, LLMs also
tend to generate false information, known as hallucination. Also, the chatbots'
responses can include content that insults personal religious beliefs,
interfaith conflicts, and controversial or sensitive topics. It must avoid such
cases without promoting hate speech or offending certain groups of people or
their beliefs. This study uses a vector database-based Retrieval Augmented
Generation (RAG) approach to enhance the accuracy and transparency of LLMs. Our
question-answering system is called ""MufassirQAS"". We created a database
consisting of several open-access books that include Turkish context. These
books contain Turkish translations and interpretations of Islam. This database
is utilized to answer religion-related questions and ensure our answers are
trustworthy. The relevant part of the dataset, which LLM also uses, is
presented along with the answer. We have put careful effort into creating
system prompts that give instructions to prevent harmful, offensive, or
disrespectful responses to respect people's values and provide reliable
results. The system answers and shares additional information, such as the page
number from the respective book and the articles referenced for obtaining the
information. MufassirQAS and ChatGPT are also tested with sensitive questions.
We got better performance with our system. Study and enhancements are still in
progress. Results and future works are given.",Ahmet Yusuf Alan
2024-01-29T16:03:29Z,http://arxiv.org/abs/2402.01741v2,"Development and Testing of a Novel Large Language Model-Based Clinical
  Decision Support Systems for Medication Safety in 12 Clinical Specialties","Importance: We introduce a novel Retrieval Augmented Generation (RAG)-Large
Language Model (LLM) framework as a Clinical Decision Support Systems (CDSS) to
support safe medication prescription.
  Objective: To evaluate the efficacy of LLM-based CDSS in correctly
identifying medication errors in different patient case vignettes from diverse
medical and surgical sub-disciplines, against a human expert panel derived
ground truth. We compared performance for under 2 different CDSS practical
healthcare integration modalities: LLM-based CDSS alone (fully autonomous mode)
vs junior pharmacist + LLM-based CDSS (co-pilot, assistive mode).
  Design, Setting, and Participants: Utilizing a RAG model with
state-of-the-art medically-related LLMs (GPT-4, Gemini Pro 1.0 and Med-PaLM 2),
this study used 61 prescribing error scenarios embedded into 23 complex
clinical vignettes across 12 different medical and surgical specialties. A
multidisciplinary expert panel assessed these cases for Drug-Related Problems
(DRPs) using the PCNE classification and graded severity / potential for harm
using revised NCC MERP medication error index. We compared.
  Results RAG-LLM performed better compared to LLM alone. When employed in a
co-pilot mode, accuracy, recall, and F1 scores were optimized, indicating
effectiveness in identifying moderate to severe DRPs. The accuracy of DRP
detection with RAG-LLM improved in several categories but at the expense of
lower precision.
  Conclusions This study established that a RAG-LLM based CDSS significantly
boosts the accuracy of medication error identification when used alongside
junior pharmacists (co-pilot), with notable improvements in detecting severe
DRPs. This study also illuminates the comparative performance of current
state-of-the-art LLMs in RAG-based CDSS systems.",Jasmine Chiat Ling Ong
2024-01-30T00:21:41Z,http://arxiv.org/abs/2402.01748v2,"Large Multi-Modal Models (LMMs) as Universal Foundation Models for
  AI-Native Wireless Systems","Large language models (LLMs) and foundation models have been recently touted
as a game-changer for 6G systems. However, recent efforts on LLMs for wireless
networks are limited to a direct application of existing language models that
were designed for natural language processing (NLP) applications. To address
this challenge and create wireless-centric foundation models, this paper
presents a comprehensive vision on how to design universal foundation models
that are tailored towards the deployment of artificial intelligence (AI)-native
networks. Diverging from NLP-based foundation models, the proposed framework
promotes the design of large multi-modal models (LMMs) fostered by three key
capabilities: 1) processing of multi-modal sensing data, 2) grounding of
physical symbol representations in real-world wireless systems using causal
reasoning and retrieval-augmented generation (RAG), and 3) enabling
instructibility from the wireless environment feedback to facilitate dynamic
network adaptation thanks to logical and mathematical reasoning facilitated by
neuro-symbolic AI. In essence, these properties enable the proposed LMM
framework to build universal capabilities that cater to various cross-layer
networking tasks and alignment of intents across different domains. Preliminary
results from experimental evaluation demonstrate the efficacy of grounding
using RAG in LMMs, and showcase the alignment of LMMs with wireless system
designs. Furthermore, the enhanced rationale exhibited in the responses to
mathematical questions by LMMs, compared to vanilla LLMs, demonstrates the
logical and mathematical reasoning capabilities inherent in LMMs. Building on
those results, we present a sequel of open questions and challenges for LMMs.
We then conclude with a set of recommendations that ignite the path towards
LMM-empowered AI-native systems.",Shengzhe Xu
2024-02-20T02:16:16Z,http://arxiv.org/abs/2402.12659v2,FinBen: A Holistic Financial Benchmark for Large Language Models,"LLMs have transformed NLP and shown promise in various fields, yet their
potential in finance is underexplored due to a lack of comprehensive evaluation
benchmarks, the rapid development of LLMs, and the complexity of financial
tasks. In this paper, we introduce FinBen, the first extensive open-source
evaluation benchmark, including 36 datasets spanning 24 financial tasks,
covering seven critical aspects: information extraction (IE), textual analysis,
question answering (QA), text generation, risk management, forecasting, and
decision-making. FinBen offers several key innovations: a broader range of
tasks and datasets, the first evaluation of stock trading, novel agent and
Retrieval-Augmented Generation (RAG) evaluation, and three novel open-source
evaluation datasets for text summarization, question answering, and stock
trading. Our evaluation of 15 representative LLMs, including GPT-4, ChatGPT,
and the latest Gemini, reveals several key findings: While LLMs excel in IE and
textual analysis, they struggle with advanced reasoning and complex tasks like
text generation and forecasting. GPT-4 excels in IE and stock trading, while
Gemini is better at text generation and forecasting. Instruction-tuned LLMs
improve textual analysis but offer limited benefits for complex tasks such as
QA. FinBen has been used to host the first financial LLMs shared task at the
FinNLP-AgentScen workshop during IJCAI-2024, attracting 12 teams. Their novel
solutions outperformed GPT-4, showcasing FinBen's potential to drive innovation
in financial LLMs. All datasets, results, and codes are released for the
research community: https://github.com/The-FinAI/PIXIU.",Qianqian Xie
2024-03-11T16:12:34Z,http://arxiv.org/abs/2403.06857v1,"Development of a Reliable and Accessible Caregiving Language Model
  (CaLM)","Unlike professional caregivers, family caregivers often assume this role
without formal preparation or training. Because of this, there is an urgent
need to enhance the capacity of family caregivers to provide quality care.
Large language models can potentially be used as a foundation technology for
supporting caregivers as educational tools or as adjunct to care. This study
aimed to develop a reliable Caregiving Language Model (CaLM) by using FMs and a
caregiving knowledge base, develop an accessible CaLM using a small FM that
requires fewer computing resources, and evaluate the performance of the model
compared to a large FM. We developed CaLM using the Retrieval Augmented
Generation (RAG) framework combined with FM fine-tuning for improving the
quality of FM answers by grounding the model on a caregiving knowledge base. We
used two small FMs as candidates for the FM of CaLM (LLaMA-2 and Falcon with 7B
parameters) and larger FM GPT-3.5 as a benchmark. We developed the caregiving
knowledge base by gathering various types of documents from the Internet. In
this study, we focused on caregivers of individuals with Alzheimer's Disease
Related Dementias. We evaluated the models' performance using the benchmark
metrics commonly used in evaluating language models and their reliability to
provide accurate references with the answers. The RAG framework improved the
performance of all FMs used in this study across all measures. As expected, the
large FM performed better than small FMs across all metrics. The most
interesting result is that small fine-tuned FMs with RAG performed
significantly better than GPT 3.5 across all metrics. The fine-tuned LLaMA-2
small FM performed better than GPT 3.5 (even with RAG) in returning references
with the answers. The study shows that reliable and accessible CaLM can be
developed by using small FMs with a knowledge base specific to the caregiving
domain.",Bambang Parmanto
2024-03-21T13:05:18Z,http://arxiv.org/abs/2403.14374v1,FIT-RAG: Black-Box RAG with Factual Information and Token Reduction,"Due to the extraordinarily large number of parameters, fine-tuning Large
Language Models (LLMs) to update long-tail or out-of-date knowledge is
impractical in lots of applications. To avoid fine-tuning, we can alternatively
treat a LLM as a black-box (i.e., freeze the parameters of the LLM) and augment
it with a Retrieval-Augmented Generation (RAG) system, namely black-box RAG.
Recently, black-box RAG has achieved success in knowledge-intensive tasks and
has gained much attention. Existing black-box RAG methods typically fine-tune
the retriever to cater to LLMs' preferences and concatenate all the retrieved
documents as the input, which suffers from two issues: (1) Ignorance of Factual
Information. The LLM preferred documents may not contain the factual
information for the given question, which can mislead the retriever and hurt
the effectiveness of black-box RAG; (2) Waste of Tokens. Simply concatenating
all the retrieved documents brings large amounts of unnecessary tokens for
LLMs, which degenerates the efficiency of black-box RAG. To address these
issues, this paper proposes a novel black-box RAG framework which utilizes the
factual information in the retrieval and reduces the number of tokens for
augmentation, dubbed FIT-RAG. FIT-RAG utilizes the factual information by
constructing a bi-label document scorer. Besides, it reduces the tokens by
introducing a self-knowledge recognizer and a sub-document-level token reducer.
FIT-RAG achieves both superior effectiveness and efficiency, which is validated
by extensive experiments across three open-domain question-answering datasets:
TriviaQA, NQ and PopQA. FIT-RAG can improve the answering accuracy of
Llama2-13B-Chat by 14.3\% on TriviaQA, 19.9\% on NQ and 27.5\% on PopQA,
respectively. Furthermore, it can save approximately half of the tokens on
average across the three datasets.",Yuren Mao
2024-03-25T21:37:30Z,http://arxiv.org/abs/2403.17209v4,"Generation of Asset Administration Shell with Large Language Model
  Agents: Toward Semantic Interoperability in Digital Twins in the Context of
  Industry 4.0","This research introduces a novel approach for achieving semantic
interoperability in digital twins and assisting the creation of Asset
Administration Shell (AAS) as digital twin model within the context of Industry
4.0. The foundational idea of our research is that the communication based on
semantics and the generation of meaningful textual data are directly linked,
and we posit that these processes are equivalent if the exchanged information
can be serialized in text form. Based on this, we construct a ""semantic node""
data structure in our research to capture the semantic essence of textual data.
Then, a system powered by large language models is designed and implemented to
process the ""semantic node"" and generate standardized digital twin models from
raw textual data collected from datasheets describing technical assets. Our
evaluation demonstrates an effective generation rate of 62-79%, indicating a
substantial proportion of the information from the source text can be
translated error-free to the target digital twin instance model with the
generative capability of large language models. This result has a direct
application in the context of Industry 4.0, and the designed system is
implemented as a data model generation tool for reducing the manual effort in
creating AAS model. In our evaluation, a comparative analysis of different LLMs
and an in-depth ablation study of Retrieval-Augmented Generation (RAG)
mechanisms provide insights into the effectiveness of LLM systems for
interpreting technical concepts and translating data. Our findings emphasize
LLMs' capability to automate AAS instance creation and contribute to the
broader field of semantic interoperability for digital twins in industrial
applications. The prototype implementation and evaluation results are presented
on our GitHub Repository: https://github.com/YuchenXia/AASbyLLM.",Yuchen Xia
