Published Date,Link,Title,Summary,First Author
2024-11-20T10:17:09Z,http://arxiv.org/abs/2411.13173v2,"Writing Style Matters: An Examination of Bias and Fairness in
  Information Retrieval Systems","The rapid advancement of Language Model technologies has opened new
opportunities, but also introduced new challenges related to bias and fairness.
This paper explores the uncharted territory of potential biases in
state-of-the-art universal text embedding models towards specific document and
query writing styles within Information Retrieval (IR) systems. Our
investigation reveals that different embedding models exhibit different
preferences of document writing style, while more informal and emotive styles
are less favored by most embedding models. In terms of query writing styles,
many embedding models tend to match the style of the query with the style of
the retrieved documents, but some show a consistent preference for specific
styles. Text embedding models fine-tuned on synthetic data generated by LLMs
display a consistent preference for certain style of generated data. These
biases in text embedding based IR systems can inadvertently silence or
marginalize certain communication styles, thereby posing a significant threat
to fairness in information retrieval. Finally, we also compare the answer
styles of Retrieval Augmented Generation (RAG) systems based on different LLMs
and find out that most text embedding models are biased towards LLM's answer
styles when used as evaluation metrics for answer correctness. This study sheds
light on the critical issue of writing style based bias in IR systems, offering
valuable insights for the development of more fair and robust models.",Hongliu Cao
2024-11-17T07:32:46Z,http://arxiv.org/abs/2411.13584v1,"AddrLLM: Address Rewriting via Large Language Model on Nationwide
  Logistics Data","Textual description of a physical location, commonly known as an address,
plays an important role in location-based services(LBS) such as on-demand
delivery and navigation. However, the prevalence of abnormal addresses, those
containing inaccuracies that fail to pinpoint a location, have led to
significant costs. Address rewriting has emerged as a solution to rectify these
abnormal addresses. Despite the critical need, existing address rewriting
methods are limited, typically tailored to correct specific error types, or
frequently require retraining to process new address data effectively. In this
study, we introduce AddrLLM, an innovative framework for address rewriting that
is built upon a retrieval augmented large language model. AddrLLM overcomes
aforementioned limitations through a meticulously designed Supervised
Fine-Tuning module, an Address-centric Retrieval Augmented Generation module
and a Bias-free Objective Alignment module. To the best of our knowledge, this
study pioneers the application of LLM-based address rewriting approach to solve
the issue of abnormal addresses. Through comprehensive offline testing with
real-world data on a national scale and subsequent online deployment, AddrLLM
has demonstrated superior performance in integration with existing logistics
system. It has significantly decreased the rate of parcel re-routing by
approximately 43\%, underscoring its exceptional efficacy in real-world
applications.",Qinchen Yang
2024-11-21T15:28:52Z,http://arxiv.org/abs/2411.14219v1,"Towards Context-Rich Automated Biodiversity Assessments: Deriving
  AI-Powered Insights from Camera Trap Data","Camera traps offer enormous new opportunities in ecological studies, but
current automated image analysis methods often lack the contextual richness
needed to support impactful conservation outcomes. Here we present an
integrated approach that combines deep learning-based vision and language
models to improve ecological reporting using data from camera traps. We
introduce a two-stage system: YOLOv10-X to localise and classify species
(mammals and birds) within images, and a Phi-3.5-vision-instruct model to read
YOLOv10-X binding box labels to identify species, overcoming its limitation
with hard to classify objects in images. Additionally, Phi-3.5 detects broader
variables, such as vegetation type, and time of day, providing rich ecological
and environmental context to YOLO's species detection output. When combined,
this output is processed by the model's natural language system to answer
complex queries, and retrieval-augmented generation (RAG) is employed to enrich
responses with external information, like species weight and IUCN status
(information that cannot be obtained through direct visual analysis). This
information is used to automatically generate structured reports, providing
biodiversity stakeholders with deeper insights into, for example, species
abundance, distribution, animal behaviour, and habitat selection. Our approach
delivers contextually rich narratives that aid in wildlife management
decisions. By providing contextually rich insights, our approach not only
reduces manual effort but also supports timely decision-making in conservation,
potentially shifting efforts from reactive to proactive management.",Paul Fergus
2024-11-21T16:28:32Z,http://arxiv.org/abs/2411.14272v1,"Efficient Aspect-Based Summarization of Climate Change Reports with
  Small Language Models","The use of Natural Language Processing (NLP) for helping decision-makers with
Climate Change action has recently been highlighted as a use case aligning with
a broader drive towards NLP technologies for social good. In this context,
Aspect-Based Summarization (ABS) systems that extract and summarize relevant
information are particularly useful as they provide stakeholders with a
convenient way of finding relevant information in expert-curated reports. In
this work, we release a new dataset for ABS of Climate Change reports and we
employ different Large Language Models (LLMs) and so-called Small Language
Models (SLMs) to tackle this problem in an unsupervised way. Considering the
problem at hand, we also show how SLMs are not significantly worse for the
problem while leading to reduced carbon footprint; we do so by applying for the
first time an existing framework considering both energy efficiency and task
performance to the evaluation of zero-shot generative models for ABS. Overall,
our results show that modern language models, both big and small, can
effectively tackle ABS for Climate Change reports but more research is needed
when we frame the problem as a Retrieval Augmented Generation (RAG) problem and
our work and dataset will help foster efforts in this direction.",Iacopo Ghinassi
2024-11-22T08:21:03Z,http://arxiv.org/abs/2411.14790v3,KBAlign: Efficient Self Adaptation on Specific Knowledge Bases,"Humans can utilize techniques to quickly acquire knowledge from specific
materials in advance, such as creating self-assessment questions, enabling us
to achieving related tasks more efficiently. In contrast, large language models
(LLMs) usually relies on retrieval-augmented generation to exploit knowledge
materials in an instant manner, or requires external signals such as human
preference data and stronger LLM annotations to conduct knowledge adaptation.
To unleash the self-learning potential of LLMs, we propose KBAlign, an approach
designed for efficient adaptation to downstream tasks involving knowledge
bases. Our method utilizes iterative training with self-annotated data such as
Q&A pairs and revision suggestions, enabling the model to grasp the knowledge
content efficiently. Experimental results on multiple datasets demonstrate the
effectiveness of our approach, significantly boosting model performance in
downstream tasks that require specific knowledge at a low cost. Notably, our
approach achieves over 90% of the performance improvement that can be obtained
by using GPT-4-turbo annotation, while relying entirely on self-supervision. We
release our experimental data, models, and process analyses to the community
for further exploration (https://github.com/thunlp/KBAlign).",Zheni Zeng
2024-11-22T16:15:50Z,http://arxiv.org/abs/2411.15041v1,"mR$^2$AG: Multimodal Retrieval-Reflection-Augmented Generation for
  Knowledge-Based VQA","Advanced Multimodal Large Language Models (MLLMs) struggle with recent
Knowledge-based VQA tasks, such as INFOSEEK and Encyclopedic-VQA, due to their
limited and frozen knowledge scope, often leading to ambiguous and inaccurate
responses. Thus, multimodal Retrieval-Augmented Generation (mRAG) is naturally
introduced to provide MLLMs with comprehensive and up-to-date knowledge,
effectively expanding the knowledge scope. However, current mRAG methods have
inherent drawbacks, including: 1) Performing retrieval even when external
knowledge is not needed. 2) Lacking of identification of evidence that supports
the query. 3) Increasing model complexity due to additional information
filtering modules or rules. To address these shortcomings, we propose a novel
generalized framework called \textbf{m}ultimodal
\textbf{R}etrieval-\textbf{R}eflection-\textbf{A}ugmented \textbf{G}eneration
(mR$^2$AG), which achieves adaptive retrieval and useful information
localization to enable answers through two easy-to-implement reflection
operations, preventing high model complexity. In mR$^2$AG, Retrieval-Reflection
is designed to distinguish different user queries and avoids redundant
retrieval calls, and Relevance-Reflection is introduced to guide the MLLM in
locating beneficial evidence of the retrieved content and generating answers
accordingly. In addition, mR$^2$AG can be integrated into any well-trained MLLM
with efficient fine-tuning on the proposed mR$^2$AG Instruction-Tuning dataset
(mR$^2$AG-IT). mR$^2$AG significantly outperforms state-of-the-art MLLMs (e.g.,
GPT-4v/o) and RAG-based MLLMs on INFOSEEK and Encyclopedic-VQA, while
maintaining the exceptional capabilities of base MLLMs across a wide range of
Visual-dependent tasks.",Tao Zhang
2024-11-20T04:47:42Z,http://arxiv.org/abs/2411.15203v1,"Multimodal large language model for wheat breeding: a new exploration of
  smart breeding","UAV remote sensing technology has become a key technology in crop breeding,
which can achieve high-throughput and non-destructive collection of crop
phenotyping data. However, the multidisciplinary nature of breeding has brought
technical barriers and efficiency challenges to knowledge mining. Therefore, it
is important to develop a smart breeding goal tool to mine cross-domain
multimodal data. Based on different pre-trained open-source multimodal large
language models (MLLMs) (e.g., Qwen-VL, InternVL, Deepseek-VL), this study used
supervised fine-tuning (SFT), retrieval-augmented generation (RAG), and
reinforcement learning from human feedback (RLHF) technologies to inject
cross-domain knowledge into MLLMs, thereby constructing multiple multimodal
large language models for wheat breeding (WBLMs). The above WBLMs were
evaluated using the newly created evaluation benchmark in this study. The
results showed that the WBLM constructed using SFT, RAG and RLHF technologies
and InternVL2-8B has leading performance. Then, subsequent experiments were
conducted using the WBLM. Ablation experiments indicated that the combination
of SFT, RAG, and RLHF technologies can improve the overall generation
performance, enhance the generated quality, balance the timeliness and
adaptability of the generated answer, and reduce hallucinations and biases. The
WBLM performed best in wheat yield prediction using cross-domain data (remote
sensing, phenotyping, weather, germplasm) simultaneously, with R2 and RMSE of
0.821 and 489.254 kg/ha, respectively. Furthermore, the WBLM can generate
professional decision support answers for phenotyping estimation, environmental
stress assessment, target germplasm screening, cultivation technique
recommendation, and seed price query tasks.",Guofeng Yang
2024-11-24T03:56:43Z,http://arxiv.org/abs/2411.15700v1,"RAMIE: Retrieval-Augmented Multi-task Information Extraction with Large
  Language Models on Dietary Supplements","\textbf{Objective:} We aimed to develop an advanced multi-task large language
model (LLM) framework to extract multiple types of information about dietary
supplements (DS) from clinical records.
  \textbf{Methods:} We used four core DS information extraction tasks - namely,
named entity recognition (NER: 2,949 clinical sentences), relation extraction
(RE: 4,892 sentences), triple extraction (TE: 2,949 sentences), and usage
classification (UC: 2,460 sentences) as our multitasks. We introduced a novel
Retrieval-Augmented Multi-task Information Extraction (RAMIE) Framework,
including: 1) employed instruction fine-tuning techniques with task-specific
prompts, 2) trained LLMs for multiple tasks with improved storage efficiency
and lower training costs, and 3) incorporated retrieval augmentation generation
(RAG) techniques by retrieving similar examples from the training set. We
compared RAMIE's performance to LLMs with instruction fine-tuning alone and
conducted an ablation study to assess the contributions of multi-task learning
and RAG to improved multitasking performance.
  \textbf{Results:} With the aid of the RAMIE framework, Llama2-13B achieved an
F1 score of 87.39 (3.51\% improvement) on the NER task and demonstrated
outstanding performance on the RE task with an F1 score of 93.74 (1.15\%
improvement). For the TE task, Llama2-7B scored 79.45 (14.26\% improvement),
and MedAlpaca-7B achieved the highest F1 score of 93.45 (0.94\% improvement) on
the UC task. The ablation study revealed that while MTL increased efficiency
with a slight trade-off in performance, RAG significantly boosted overall
accuracy.
  \textbf{Conclusion:} This study presents a novel RAMIE framework that
demonstrates substantial improvements in multi-task information extraction for
DS-related data from clinical records. Our framework can potentially be applied
to other domains.",Zaifu Zhan
2024-11-25T15:35:51Z,http://arxiv.org/abs/2411.16495v2,"AtomR: Atomic Operator-Empowered Large Language Models for Heterogeneous
  Knowledge Reasoning","Recent advancements in large language models (LLMs) have led to significant
improvements in various natural language processing tasks, but it is still
challenging for LLMs to perform knowledge-intensive complex question answering
due to LLMs' inefficacy in reasoning planning and the hallucination problem. A
typical solution is to employ retrieval-augmented generation (RAG) coupled with
chain-of-thought (CoT) reasoning, which decomposes complex questions into
chain-like sub-questions and applies iterative RAG at each sub-question.
However, prior works exhibit sub-optimal reasoning planning and overlook
dynamic knowledge retrieval from heterogeneous sources. In this paper, we
propose AtomR, a novel heterogeneous knowledge reasoning framework that
conducts multi-source reasoning at the atomic level. Drawing inspiration from
the graph modeling of knowledge, AtomR leverages large language models (LLMs)
to decompose complex questions into combinations of three atomic knowledge
operators, significantly enhancing the reasoning process at both the planning
and execution stages. We also introduce BlendQA, a novel evaluation benchmark
tailored to assess complex heterogeneous knowledge reasoning. Experiments show
that AtomR significantly outperforms state-of-the-art baselines across three
single-source and two multi-source reasoning benchmarks, with notable
performance gains of 9.4% on 2WikiMultihop and 9.5% on BlendQA.",Amy Xin
2024-11-23T18:14:42Z,http://arxiv.org/abs/2411.16740v3,"Document Haystacks: Vision-Language Reasoning Over Piles of 1000+
  Documents","Large multimodal models (LMMs) have achieved impressive progress in
vision-language understanding, yet they face limitations in real-world
applications requiring complex reasoning over a large number of images.
Existing benchmarks for multi-image question-answering are limited in scope,
each question is paired with only up to 30 images, which does not fully capture
the demands of large-scale retrieval tasks encountered in the real-world
usages. To reduce these gaps, we introduce two document haystack benchmarks,
dubbed DocHaystack and InfoHaystack, designed to evaluate LMM performance on
large-scale visual document retrieval and understanding. Additionally, we
propose V-RAG, a novel, vision-centric retrieval-augmented generation (RAG)
framework that leverages a suite of multimodal vision encoders, each optimized
for specific strengths, and a dedicated question-document relevance module.
V-RAG sets a new standard, with a 9% and 11% improvement in Recall@1 on the
challenging DocHaystack-1000 and InfoHaystack-1000 benchmarks, respectively,
compared to the previous best baseline models. Additionally, integrating V-RAG
with LMMs enables them to efficiently operate across thousands of images,
yielding significant improvements on our DocHaystack and InfoHaystack
benchmarks. Our code and datasets are available at
https://github.com/Vision-CAIR/dochaystacks",Jun Chen
2024-11-28T06:29:46Z,http://arxiv.org/abs/2411.18948v1,"Knowledge Database or Poison Base? Detecting RAG Poisoning Attack
  through LLM Activations","As Large Language Models (LLMs) are progressively deployed across diverse
fields and real-world applications, ensuring the security and robustness of
LLMs has become ever more critical. Retrieval-Augmented Generation (RAG) is a
cutting-edge approach designed to address the limitations of large language
models (LLMs). By retrieving information from the relevant knowledge database,
RAG enriches the input to LLMs, enabling them to produce responses that are
more accurate and contextually appropriate. It is worth noting that the
knowledge database, being sourced from publicly available channels such as
Wikipedia, inevitably introduces a new attack surface. RAG poisoning involves
injecting malicious texts into the knowledge database, ultimately leading to
the generation of the attacker's target response (also called poisoned
response). However, there are currently limited methods available for detecting
such poisoning attacks. We aim to bridge the gap in this work. Particularly, we
introduce RevPRAG, a flexible and automated detection pipeline that leverages
the activations of LLMs for poisoned response detection. Our investigation
uncovers distinct patterns in LLMs' activations when generating correct
responses versus poisoned responses. Our results on multiple benchmark datasets
and RAG architectures show our approach could achieve 98% true positive rate,
while maintaining false positive rates close to 1%. We also evaluate recent
backdoor detection methods specifically designed for LLMs and applicable for
identifying poisoned responses in RAG. The results demonstrate that our
approach significantly surpasses them.",Xue Tan
2024-11-28T11:24:43Z,http://arxiv.org/abs/2411.19064v1,"Way to Specialist: Closing Loop Between Specialized LLM and Evolving
  Domain Knowledge Graph","Large language models (LLMs) have demonstrated exceptional performance across
a wide variety of domains. Nonetheless, generalist LLMs continue to fall short
in reasoning tasks necessitating specialized knowledge. Prior investigations
into specialized LLMs focused on domain-specific training, which entails
substantial efforts in domain data acquisition and model parameter fine-tuning.
To address these challenges, this paper proposes the Way-to-Specialist (WTS)
framework, which synergizes retrieval-augmented generation with knowledge
graphs (KGs) to enhance the specialized capability of LLMs in the absence of
specialized training. In distinction to existing paradigms that merely utilize
external knowledge from general KGs or static domain KGs to prompt LLM for
enhanced domain-specific reasoning, WTS proposes an innovative
""LLM$\circlearrowright$KG"" paradigm, which achieves bidirectional enhancement
between specialized LLM and domain knowledge graph (DKG). The proposed paradigm
encompasses two closely coupled components: the DKG-Augmented LLM and the
LLM-Assisted DKG Evolution. The former retrieves question-relevant domain
knowledge from DKG and uses it to prompt LLM to enhance the reasoning
capability for domain-specific tasks; the latter leverages LLM to generate new
domain knowledge from processed tasks and use it to evolve DKG. WTS closes the
loop between DKG-Augmented LLM and LLM-Assisted DKG Evolution, enabling
continuous improvement in the domain specialization as it progressively answers
and learns from domain-specific questions. We validate the performance of WTS
on 6 datasets spanning 5 domains. The experimental results show that WTS
surpasses the previous SOTA in 4 specialized domains and achieves a maximum
performance improvement of 11.3%.",Yutong Zhang
2024-11-28T15:53:27Z,http://arxiv.org/abs/2411.19229v2,Habit Coach: Customising RAG-based chatbots to support behavior change,"This paper presents the iterative development of Habit Coach, a GPT-based
chatbot designed to support users in habit change through personalized
interaction. Employing a user-centered design approach, we developed the
chatbot using a Retrieval-Augmented Generation (RAG) system, which enables
behavior personalization without retraining the underlying language model
(GPT-4). The system leverages document retrieval and specialized prompts to
tailor interactions, drawing from Cognitive Behavioral Therapy (CBT) and
narrative therapy techniques. A key challenge in the development process was
the difficulty of translating declarative knowledge into effective interaction
behaviors. In the initial phase, the chatbot was provided with declarative
knowledge about CBT via reference textbooks and high-level conversational
goals. However, this approach resulted in imprecise and inefficient behavior,
as the GPT model struggled to convert static information into dynamic and
contextually appropriate interactions. This highlighted the limitations of
relying solely on declarative knowledge to guide chatbot behavior, particularly
in nuanced, therapeutic conversations. Over four iterations, we addressed this
issue by gradually transitioning towards procedural knowledge, refining the
chatbot's interaction strategies, and improving its overall effectiveness. In
the final evaluation, 5 participants engaged with the chatbot over five
consecutive days, receiving individualized CBT interventions. The Self-Report
Habit Index (SRHI) was used to measure habit strength before and after the
intervention, revealing a reduction in habit strength post-intervention. These
results underscore the importance of procedural knowledge in driving effective,
personalized behavior change support in RAG-based systems.",Arian Fooroogh Mand Arabi
2024-11-29T05:31:04Z,http://arxiv.org/abs/2411.19478v1,"Zero-Indexing Internet Search Augmented Generation for Large Language
  Models","Retrieval augmented generation has emerged as an effective method to enhance
large language model performance. This approach typically relies on an internal
retrieval module that uses various indexing mechanisms to manage a static
pre-processed corpus. However, such a paradigm often falls short when it is
necessary to integrate the most up-to-date information that has not been
updated into the corpus during generative inference time. In this paper, we
explore an alternative approach that leverages standard search engine APIs to
dynamically integrate the latest online information (without maintaining any
index for any fixed corpus), thereby improving the quality of generated
content. We design a collaborative LLM-based paradigm, where we include: (i) a
parser-LLM that determines if the Internet augmented generation is demanded and
extracts the search keywords if so with a single inference; (ii) a mixed
ranking strategy that re-ranks the retrieved HTML files to eliminate bias
introduced from the search engine API; and (iii) an extractor-LLM that can
accurately and efficiently extract relevant information from the fresh content
in each HTML file. We conduct extensive empirical studies to evaluate the
performance of this Internet search augmented generation paradigm. The
experimental results demonstrate that our method generates content with
significantly improved quality. Our system has been successfully deployed in a
production environment to serve 01.AI's generative inference requests.",Guangxin He
